{
  "version": "1.0",
  "权威源映射": {
    "法定代表人": ["qcc_工商注册", "上市公司年报"],
    "实控人": ["qcc_实际控制人", "上市公司年报"],
    "股东": ["qcc_股东", "上市公司定期报告"],
    "董监高": ["qcc_高管", "上市公司年报"],
    "融资金额": ["公司公告/招股书", "IT 桔子", "媒体"],
    "估值": ["公司公告/招股书", "IT 桔子", "媒体"],
    "财务数据": ["上市公司财报", "iFinD", "Wind", "qcc_财务"],
    "行情": ["交易所", "iFinD", "Wind"],
    "IPO在审": ["交易所审核官网"],
    "辅导备案": ["证监会官网"],
    "并购重组": ["交易所审核官网", "公司公告"],
    "专利": ["国家知识产权局", "qcc_专利"],
    "商标": ["国家知识产权局商标局", "qcc_商标"],
    "行政处罚": ["监管公示", "qcc_风险扫描"],
    "涉诉": ["裁判文书网", "qcc_司法"],
    "政策": ["官方发布", "可信搜索", "媒体"],
    "行业动态": ["官方发布", "权威媒体", "财经媒体"]
  },
  "通用降级": [
    "官方一手源（交易所/证监会/公司公告/招股书）",
    "权威金融数据（iFinD/Wind）",
    "专业数据（企查查工商/IT 桔子）",
    "媒体报道/新闻"
  ],
  "冲突处理": {
    "规则": "按字段权威源映射取高优先级源",
    "记录": "冲突内容 + 采用源 + 理由 写入 溯源.jsonl 的 conflict 字段",
    "兜底": "官方源拿不到时，用次一级源并标注『未能与官方源交叉验证』"
  },
  "降级链": {
    "IPO在审": "交易所审核官网 → mx-ds-mcp / iFinD → 标注无法获取",
    "辅导备案": "证监会官网 → iFinD 辅导备案 → 标注无法获取",
    "再融资/并购": "交易所审核官网 → mx-ds-mcp / iFinD → 标注无法获取",
    "一级市场融资": "IT 桔子 → 财经媒体检索 / mx_finance_search_news → 标注无法获取",
    "法定代表人": "qcc → 巨潮 / 招股书 → 标注无法获取",
    "财务数据": "上市公司财报 / iFinD / Wind → qcc 财务 → 源文件标财报期",
    "政策": "dknowc可信搜索 / 官方发布 → mx_finance_search_news / web_search → 标注无法获取"
  }
}